{
  "schema_version": 2,
  "id": "smart.tooltip",
  "version": "1.0.0",
  "title": "Tooltip",
  "summary": "Tooltip surface that can join the ordinary data-tooltip trigger composition.",
  "kind": "smart",
  "reuse_mode": "whole",
  "lifecycle": "released",
  "tags": [
    "tooltip"
  ],
  "capabilities": [
    "render",
    "theme",
    "responsive",
    "accessibility"
  ],
  "custom_element": "sf-tooltip",
  "templates": [
    "default"
  ],
  "exported_parts": [],
  "composition": {
    "uses": [],
    "public_parts": []
  },
  "inputs": {
    "type": "object",
    "properties": {
      "template": {
        "type": "string",
        "default": "default",
        "enum": [
          "default"
        ],
        "description": "Template name."
      },
      "appearance": {
        "type": "string",
        "default": "light",
        "description": "How the tooltip looks: light on a dark surface or the reverse.",
        "enum": [
          "light",
          "dark"
        ]
      },
      "size": {
        "type": "string",
        "default": "1",
        "enum": [
          "1/3",
          "1/2",
          "1",
          "2",
          "3"
        ],
        "description": "Framework typography and spacing scale."
      },
      "arrow": {
        "type": "string",
        "default": "none",
        "enum": [
          "none",
          "top-center",
          "bottom-center",
          "inline-start",
          "inline-end",
          "bottom-inline-start",
          "bottom-inline-end"
        ],
        "description": "Logical tail placement."
      },
      "text": {
        "type": "string",
        "default": "",
        "description": "Short primary description."
      },
      "supporting-text": {
        "type": "string",
        "default": "",
        "description": "Optional secondary description."
      },
      "type": {
        "type": "string",
        "default": "light",
        "description": "Legacy name for appearance, still honoured. See contracts/public-api-axes.json.",
        "enum": [
          "light",
          "dark"
        ]
      },
      "root-class": {
        "type": "string",
        "default": "",
        "description": "Framework utility classes for the visible surface root."
      }
    },
    "additionalProperties": false
  },
  "item_contract": {},
  "contracts": {},
  "methods": {},
  "events": {},
  "state": {
    "machines": {},
    "visual_states": [
      "default"
    ]
  },
  "persistence": {
    "mode": "none",
    "source_of_truth": "component",
    "network_owner": "none",
    "revision_field": null
  },
  "ownership": {
    "source": "simai/ui-source",
    "data": "fixture",
    "effects": "component",
    "forbidden_client_responsibilities": [
      "backend access decisions",
      "host route invention"
    ]
  },
  "security": {
    "permissions_owner": "none",
    "untrusted_inputs": [
      "props",
      "children"
    ],
    "network_policy": "deny"
  },
  "accessibility": {
    "role": "tooltip when linked by the ordinary data-tooltip controller",
    "accessible_name": "internal",
    "keyboard": [
      "Escape dismisses a linked open tooltip without moving trigger focus"
    ],
    "focus": "The surface never receives focus. A linked native trigger owns focus and aria-describedby."
  },
  "presentation": {
    "themes": [
      "light",
      "dark"
    ],
    "locales": [
      "ru",
      "en"
    ],
    "responsive": [
      "desktop",
      "mobile"
    ]
  },
  "adapter": {
    "kind": "generic",
    "protocol": "simai.smart-studio-adapter.v1",
    "module": null
  },
  "artifacts": {
    "fixtures": [
      "studio.fixture.json"
    ],
    "scenarios": [
      "studio.scenario.json"
    ]
  },
  "readiness": {
    "level": "accepted",
    "required_checks": [
      "manifest",
      "fixture",
      "runtime-upgrade",
      "scenario-smoke"
    ]
  },
  "compatibility": {
    "contract_schema": {
      "id": "https://simai.io/contracts/smart-component-manifest.v2.schema.json",
      "version": 2
    },
    "runtime_pair": {
      "ui_revision": "8f2b40e21d0bdb9b5f0e16f1c2daf05cebde3de4",
      "ui_smart_revision": "7df7741ba8d0d28f3d4e4bf82f39391be2ad5cf2"
    },
    "aliases": [],
    "deprecations": [],
    "replacement": null,
    "migrations": []
  },
  "provenance": {
    "source_repository": "simai/ui-source",
    "source_revision": "1a130df271858537996f12cae8af4cc3b0b489cd",
    "source_artifacts": [
      {
        "path": "src/smart/tooltip/index.js",
        "sha256": "ca43ae4fe63bc8fb6520b40c4e0f8c755d6de297d6d5d79e4ee1beb17a9a1b2f"
      }
    ],
    "generated_runtime": [
      {
        "repository": "simai/ui-smart",
        "revision": "7df7741ba8d0d28f3d4e4bf82f39391be2ad5cf2",
        "path": "smart/tooltip/js/tooltip.js",
        "sha256": "9182b53cd78823ea9bdce7ddf9717a2c72e3e22f87e0c8da837d9f5631ba4085"
      }
    ]
  },
  "ai_guidance": {
    "use_when": "Use sf-tooltip for a short non-interactive description. Link it to a native trigger with the ordinary data-tooltip composition when Framework should own hover, focus and Escape behavior.",
    "do_not": [
      "Do not copy generated ui-smart code",
      "Do not move host data or access decisions into the component",
      "Do not place links, buttons or fields inside a tooltip",
      "Do not use aria-expanded or aria-haspopup for tooltip visibility"
    ],
    "required_reads": [
      "inputs",
      "methods",
      "events",
      "ownership",
      "provenance"
    ],
    "minimal_example": "<sf-tooltip text=\"Hint\"></sf-tooltip>",
    "owner_commands": [
      "npm run contract:verify",
      "npm test"
    ]
  }
}
