{
  "schema_version": 2,
  "id": "smart.alert",
  "version": "1.0.0",
  "title": "Alert",
  "summary": "Persistent inline notice with semantic roles, optional actions and dismiss behavior.",
  "kind": "smart",
  "reuse_mode": "whole",
  "lifecycle": "experimental",
  "tags": [
    "alert"
  ],
  "capabilities": [
    "render",
    "theme",
    "responsive"
  ],
  "custom_element": "sf-alert",
  "templates": [
    "default"
  ],
  "exported_parts": [],
  "composition": {
    "uses": [
      "component.alerts",
      "component.buttons",
      "smart.icons",
      "smart.icon-buttons"
    ],
    "public_parts": []
  },
  "inputs": {
    "type": "object",
    "properties": {
      "template": {
        "type": "string",
        "default": "default",
        "enum": [
          "default"
        ]
      },
      "type": {
        "type": "string",
        "default": "clear",
        "description": "Semantic message role; choose it from meaning rather than desired color.",
        "enum": [
          "clear",
          "info",
          "danger",
          "warning",
          "success"
        ]
      },
      "variant": {
        "type": "string",
        "default": "default",
        "description": "Surface treatment of the notice.",
        "enum": [
          "default",
          "outlined",
          "flat"
        ]
      },
      "icon": {
        "type": "string",
        "default": "",
        "description": "Optional icon override. Use none to hide the semantic icon."
      },
      "title": {
        "type": "string",
        "default": "",
        "description": "Short message heading."
      },
      "supporting-text": {
        "type": "string",
        "default": "",
        "description": "Supporting body text at the normal text size."
      },
      "action-text": {
        "type": "string",
        "default": "",
        "description": "Visible label of the primary optional action."
      },
      "action": {
        "type": "string",
        "default": "action",
        "description": "Stable action value emitted in sf-alert-action."
      },
      "secondary-action-text": {
        "type": "string",
        "default": "",
        "description": "Visible label of the secondary optional action."
      },
      "secondary-action": {
        "type": "string",
        "default": "secondary",
        "description": "Stable secondary action value emitted in sf-alert-action."
      },
      "closable": {
        "type": "boolean",
        "default": false,
        "description": "Render an explicitly named close action."
      },
      "close-label": {
        "type": "string",
        "default": "Close alert",
        "description": "Localized accessible name of the close action."
      },
      "root-class": {
        "type": "string",
        "default": ""
      }
    },
    "additionalProperties": false
  },
  "item_contract": {},
  "contracts": {
    "semantic_types": {
      "type": "string",
      "enum": [
        "clear",
        "info",
        "danger",
        "warning",
        "success"
      ]
    },
    "surface_variants": {
      "type": "string",
      "enum": [
        "default",
        "outlined",
        "flat"
      ]
    },
    "canonical_behavior_attributes": {
      "type": "string",
      "enum": [
        "data-action",
        "data-close"
      ]
    },
    "dismissal_state": {
      "const": "closing"
    },
    "live_region_guidance": {
      "assertive": "role=alert only for a newly inserted urgent message",
      "polite": "role=status for a newly inserted non-urgent update",
      "static": "omit a live-region role when the notice is present on initial page load"
    }
  },
  "methods": {
    "close": {
      "summary": "Public runtime method close.",
      "arguments": [],
      "returns": {
        "type": [
          "object",
          "boolean",
          "null"
        ]
      }
    },
    "onAction": {
      "summary": "Public runtime method onAction.",
      "arguments": [],
      "returns": {
        "type": [
          "object",
          "boolean",
          "null"
        ]
      }
    },
    "onClose": {
      "summary": "Public runtime method onClose.",
      "arguments": [],
      "returns": {
        "type": [
          "object",
          "boolean",
          "null"
        ]
      }
    }
  },
  "events": {
    "sf-alert-action": {
      "summary": "Runtime event sf-alert-action.",
      "payload": {
        "type": "object"
      }
    },
    "sf-alert-close": {
      "summary": "Runtime event sf-alert-close.",
      "payload": {
        "type": "object"
      }
    }
  },
  "state": {
    "machines": {},
    "visual_states": [
      "default"
    ]
  },
  "persistence": {
    "mode": "none",
    "source_of_truth": "component",
    "network_owner": "none",
    "revision_field": null
  },
  "ownership": {
    "source": "simai/ui-source",
    "data": "fixture",
    "effects": "component",
    "forbidden_client_responsibilities": [
      "backend access decisions",
      "host route invention"
    ]
  },
  "security": {
    "permissions_owner": "none",
    "untrusted_inputs": [
      "props",
      "children"
    ],
    "network_policy": "deny"
  },
  "accessibility": {
    "role": null,
    "accessible_name": "internal",
    "keyboard": [
      "Tab"
    ],
    "focus": "Actions use native focus-visible behavior; after dismissal the application restores focus only when it was inside the removed notice."
  },
  "presentation": {
    "themes": [
      "light",
      "dark"
    ],
    "locales": [
      "ru",
      "en"
    ],
    "responsive": [
      "desktop",
      "mobile"
    ]
  },
  "adapter": {
    "kind": "generic",
    "protocol": "simai.smart-studio-adapter.v1",
    "module": null
  },
  "artifacts": {
    "fixtures": [
      "studio.fixture.json"
    ],
    "scenarios": [
      "studio.scenario.json"
    ]
  },
  "readiness": {
    "level": "described",
    "required_checks": [
      "manifest",
      "fixture",
      "runtime-upgrade",
      "scenario-smoke"
    ]
  },
  "compatibility": {
    "contract_schema": {
      "id": "https://simai.io/contracts/smart-component-manifest.v2.schema.json",
      "version": 2
    },
    "runtime_pair": {
      "ui_revision": "2228262ad3588227b20045f66ca43556fcd27974",
      "ui_smart_revision": "8b0e0482f78a19aa6af2483d61fe9fe3b79a8e1b"
    },
    "aliases": [],
    "deprecations": [],
    "replacement": null,
    "migrations": []
  },
  "provenance": {
    "source_repository": "simai/ui-source",
    "source_revision": "fbea718f2a7fcf7450ec0a5a52a512fc805aa823",
    "source_artifacts": [
      {
        "path": "src/smart/alert/index.js",
        "sha256": "fbd6b6f0bddcdd8718c92f6e7a54cb804c6a767129c5f45bb4e99c752ed9cbd3"
      }
    ],
    "generated_runtime": [
      {
        "repository": "simai/ui-smart",
        "revision": "8b0e0482f78a19aa6af2483d61fe9fe3b79a8e1b",
        "path": "smart/alert/js/alert.js",
        "sha256": "9fa2e29f067379f8400ee4a5bd0ef34832baee42f5a8394f48796719d07e75fa"
      }
    ]
  },
  "ai_guidance": {
    "use_when": "Use sf-alert for persistent inline guidance, warning, error or success feedback inside the page flow.",
    "do_not": [
      "Do not use Alert for transient overlay feedback; use Toast",
      "Do not choose a semantic type only for its color",
      "Do not add role=alert to a static message that is already present on page load",
      "Do not copy generated ui-smart code",
      "Do not move host data or access decisions into the component"
    ],
    "required_reads": [
      "inputs",
      "methods",
      "events",
      "ownership",
      "provenance"
    ],
    "minimal_example": "<sf-alert type=\"info\" title=\"Update available\" supporting-text=\"Save your changes before refreshing.\"></sf-alert>",
    "owner_commands": [
      "npm run contract:verify",
      "npm test"
    ]
  }
}
