{
  "schema_version": 2,
  "id": "smart.close",
  "version": "1.0.0",
  "title": "Close",
  "summary": "Close Smart Component from SIMAI Framework.",
  "kind": "smart",
  "reuse_mode": "whole",
  "lifecycle": "experimental",
  "tags": [
    "close"
  ],
  "capabilities": [
    "render",
    "theme",
    "responsive"
  ],
  "custom_element": "sf-close",
  "templates": [
    "default"
  ],
  "exported_parts": [],
  "composition": {
    "uses": [],
    "public_parts": []
  },
  "inputs": {
    "type": "object",
    "properties": {
      "size": {
        "type": "string",
        "default": "1/3",
        "description": "Decorative close-glyph size token.",
        "enum": [
          "1/4",
          "1/3",
          "1/2",
          "1",
          "2",
          "3",
          "4",
          "5",
          "6",
          "7"
        ]
      },
      "root-class": {
        "type": "string",
        "default": ""
      }
    },
    "additionalProperties": false
  },
  "item_contract": {},
  "contracts": {},
  "methods": {},
  "events": {},
  "state": {
    "machines": {},
    "visual_states": [
      "default"
    ]
  },
  "persistence": {
    "mode": "none",
    "source_of_truth": "component",
    "network_owner": "none",
    "revision_field": null
  },
  "ownership": {
    "source": "simai/ui-source",
    "data": "fixture",
    "effects": "component",
    "forbidden_client_responsibilities": [
      "backend access decisions",
      "host route invention"
    ]
  },
  "security": {
    "permissions_owner": "none",
    "untrusted_inputs": [
      "props",
      "children"
    ],
    "network_policy": "deny"
  },
  "accessibility": {
    "role": "none; generated glyph is aria-hidden",
    "accessible_name": "internal",
    "keyboard": [],
    "focus": "Close is decorative and never enters the tab order. The containing native button owns focus."
  },
  "presentation": {
    "themes": [
      "light",
      "dark"
    ],
    "locales": [
      "ru",
      "en"
    ],
    "responsive": [
      "desktop",
      "mobile"
    ]
  },
  "adapter": {
    "kind": "generic",
    "protocol": "simai.smart-studio-adapter.v1",
    "module": null
  },
  "artifacts": {
    "fixtures": [
      "studio.fixture.json"
    ],
    "scenarios": [
      "studio.scenario.json"
    ]
  },
  "readiness": {
    "level": "described",
    "required_checks": [
      "manifest",
      "fixture",
      "runtime-upgrade",
      "scenario-smoke"
    ]
  },
  "compatibility": {
    "contract_schema": {
      "id": "https://simai.io/contracts/smart-component-manifest.v2.schema.json",
      "version": 2
    },
    "runtime_pair": {
      "ui_revision": "2228262ad3588227b20045f66ca43556fcd27974",
      "ui_smart_revision": "8b0e0482f78a19aa6af2483d61fe9fe3b79a8e1b"
    },
    "aliases": [],
    "deprecations": [],
    "replacement": null,
    "migrations": []
  },
  "provenance": {
    "source_repository": "simai/ui-source",
    "source_revision": "fbea718f2a7fcf7450ec0a5a52a512fc805aa823",
    "source_artifacts": [
      {
        "path": "src/smart/close/index.js",
        "sha256": "ce322c0fdc5adc699fefcf88dee21f41869520b186b322a410637b44eea1a5cf"
      }
    ],
    "generated_runtime": [
      {
        "repository": "simai/ui-smart",
        "revision": "8b0e0482f78a19aa6af2483d61fe9fe3b79a8e1b",
        "path": "smart/close/js/close.js",
        "sha256": "f2abd1babb081a7501929c78388a613e35f7d1bdb8705ea19ef0346a201fbe08"
      }
    ]
  },
  "ai_guidance": {
    "use_when": "Use sf-close only as the decorative cross glyph inside a host-owned close action.",
    "do_not": [
      "Do not copy generated ui-smart code",
      "Do not move host data or access decisions into the component",
      "Do not make sf-close focusable or use it as the action owner"
    ],
    "required_reads": [
      "inputs",
      "methods",
      "events",
      "ownership",
      "provenance"
    ],
    "minimal_example": "<button type=\"button\" class=\"sf-icon-button sf-icon-button--close sf-icon-button--link sf-icon-button--on-surface sf-icon-button--size-1 flex items-cross-center\" aria-label=\"Close notification\"><sf-close size=\"1\"></sf-close></button>",
    "owner_commands": [
      "npm run contract:verify",
      "npm test"
    ]
  }
}
