{
  "schema_version": 2,
  "id": "smart.tree",
  "version": "1.0.0",
  "title": "Tree",
  "summary": "Accessible hierarchical composite with roving focus, branch expansion and host-owned selection.",
  "kind": "smart",
  "reuse_mode": "whole",
  "lifecycle": "experimental",
  "tags": [
    "tree"
  ],
  "capabilities": [
    "render",
    "keyboard-navigation",
    "selection",
    "theme",
    "responsive"
  ],
  "custom_element": "sf-tree",
  "templates": [
    "default"
  ],
  "exported_parts": [],
  "composition": {
    "uses": [
      "component.tree",
      "smart.tree-item"
    ],
    "public_parts": []
  },
  "inputs": {
    "type": "object",
    "properties": {
      "template": {
        "type": "string",
        "default": "default",
        "enum": [
          "default"
        ]
      },
      "root-class": {
        "type": "string",
        "default": ""
      },
      "aria-label": {
        "type": "string",
        "default": ""
      },
      "role": {
        "type": "string",
        "default": "tree",
        "enum": [
          "tree"
        ]
      },
      "selection": {
        "type": "string",
        "default": "none",
        "enum": [
          "none",
          "single",
          "multiple"
        ]
      }
    },
    "additionalProperties": false
  },
  "item_contract": {},
  "contracts": {},
  "methods": {
    "onToggle": {
      "summary": "Public runtime method onToggle.",
      "arguments": [],
      "returns": {
        "type": [
          "object",
          "boolean",
          "null"
        ]
      }
    }
  },
  "events": {
    "sf-tree-selection-change": {
      "summary": "Selection requested or changed for a tree item.",
      "payload": {
        "type": "object"
      }
    }
  },
  "state": {
    "machines": {
      "disclosure": [
        "closed",
        "open"
      ],
      "focus": [
        "active"
      ],
      "selection": [
        "selected"
      ]
    },
    "visual_states": [
      "default",
      "active",
      "selected",
      "open",
      "closed"
    ]
  },
  "persistence": {
    "mode": "none",
    "source_of_truth": "component",
    "network_owner": "none",
    "revision_field": null
  },
  "ownership": {
    "source": "simai/ui-source",
    "data": "fixture",
    "effects": "component",
    "forbidden_client_responsibilities": [
      "backend access decisions",
      "host route invention"
    ]
  },
  "security": {
    "permissions_owner": "none",
    "untrusted_inputs": [
      "props",
      "children"
    ],
    "network_policy": "deny"
  },
  "accessibility": {
    "role": "tree",
    "accessible_name": "required",
    "keyboard": [
      "Tab",
      "ArrowUp",
      "ArrowDown",
      "ArrowLeft",
      "ArrowRight",
      "Home",
      "End",
      "Enter",
      "Space",
      "typeahead"
    ],
    "focus": "One visible tree item is in the page tab order; arrows move roving focus independently of selection."
  },
  "presentation": {
    "themes": [
      "light",
      "dark"
    ],
    "locales": [
      "ru",
      "en"
    ],
    "responsive": [
      "desktop",
      "mobile"
    ]
  },
  "adapter": {
    "kind": "generic",
    "protocol": "simai.smart-studio-adapter.v1",
    "module": null
  },
  "artifacts": {
    "fixtures": [
      "studio.fixture.json"
    ],
    "scenarios": [
      "studio.scenario.json"
    ]
  },
  "readiness": {
    "level": "described",
    "required_checks": [
      "manifest",
      "fixture",
      "runtime-upgrade",
      "scenario-smoke"
    ]
  },
  "compatibility": {
    "contract_schema": {
      "id": "https://simai.io/contracts/smart-component-manifest.v2.schema.json",
      "version": 2
    },
    "runtime_pair": {
      "ui_revision": "8f2b40e21d0bdb9b5f0e16f1c2daf05cebde3de4",
      "ui_smart_revision": "7df7741ba8d0d28f3d4e4bf82f39391be2ad5cf2"
    },
    "aliases": [],
    "deprecations": [],
    "replacement": null,
    "migrations": []
  },
  "provenance": {
    "source_repository": "simai/ui-source",
    "source_revision": "1a130df271858537996f12cae8af4cc3b0b489cd",
    "source_artifacts": [
      {
        "path": "src/smart/tree/index.js",
        "sha256": "8e6d071a6497a12110e38b791c1604a594148d4c58ba9a58c39dbbf2685ed685"
      },
      {
        "path": "src/smart/tree/js/templates/default.js",
        "sha256": "dae4e03e919a2aec257ef007f417a3ef5bb2c9c293677213fe01765e866bb41b"
      },
      {
        "path": "src/smart/tree/js/templates/default.css",
        "sha256": "c1d70828d6f1cd5066a14e449827ba5398b1b7c95b436aef07006ddef9befcb9"
      },
      {
        "path": "src/smart/tree/rule.js",
        "sha256": "361bd8b45dfe53b9ed05488289b3f4924aeca5b2f10a7f39eeb9b28bdd47c945"
      },
      {
        "path": "src/smart/tree/docs/docs.md",
        "sha256": "170b7cfae832436de8e9c8aa54eb5714d7ffe8730129f68f5aef9ccfa0b4d36b"
      }
    ],
    "generated_runtime": [
      {
        "repository": "simai/ui-smart",
        "revision": "7df7741ba8d0d28f3d4e4bf82f39391be2ad5cf2",
        "path": "smart/tree/js/tree.js",
        "sha256": "63fa149c88cc06b623a4865f75be133eacfb5cec78b23863a9dea2db4873eb2f"
      }
    ]
  },
  "ai_guidance": {
    "use_when": "Use sf-tree for file-like, taxonomy or navigation hierarchies that need composite keyboard navigation.",
    "do_not": [
      "Do not copy generated ui-smart code",
      "Do not use Tree for a short independent disclosure list",
      "Do not move host data, persistence or access decisions into the component"
    ],
    "required_reads": [
      "inputs",
      "methods",
      "events",
      "ownership",
      "provenance"
    ],
    "minimal_example": "<sf-tree></sf-tree>",
    "owner_commands": [
      "npm run contract:verify",
      "npm test"
    ]
  }
}
