{
  "schema_version": 2,
  "id": "smart.download-file",
  "version": "1.0.0",
  "title": "Download File",
  "summary": "Native file download or application-owned file preparation action.",
  "kind": "smart",
  "reuse_mode": "whole",
  "lifecycle": "experimental",
  "tags": [
    "download-file"
  ],
  "capabilities": [
    "render",
    "theme",
    "responsive"
  ],
  "custom_element": "sf-download-file",
  "templates": [
    "default"
  ],
  "exported_parts": [],
  "composition": {
    "uses": [
      "component.download-file",
      "smart.icons"
    ],
    "public_parts": []
  },
  "inputs": {
    "type": "object",
    "properties": {
      "template": {
        "type": "string",
        "default": "default",
        "enum": [
          "default"
        ]
      },
      "size": {
        "type": "string",
        "default": "1",
        "enum": [
          "1/3",
          "1/2",
          "1",
          "2",
          "3"
        ],
        "description": "Existing compact-to-prominent component size scale."
      },
      "file-name": {
        "type": "string",
        "default": "File.pdf",
        "description": "Visible filename and default native download name."
      },
      "file-size": {
        "type": "string",
        "default": "",
        "description": "Known human-readable size. Pass it when available to avoid discovery."
      },
      "icon": {
        "type": "string",
        "default": "download",
        "description": "Decorative icon name."
      },
      "href": {
        "type": "string",
        "default": "",
        "description": "Real resource destination; renders a native anchor when enabled."
      },
      "download": {
        "type": "boolean",
        "default": false,
        "description": "Apply native download semantics to an anchor destination."
      },
      "disabled": {
        "type": "boolean",
        "default": false,
        "description": "Render a disabled button with no live destination."
      },
      "target": {
        "type": "string",
        "default": "_blank"
      },
      "aria-label": {
        "type": "string",
        "default": ""
      }
    },
    "additionalProperties": false
  },
  "item_contract": {},
  "contracts": {
    "owner_semantics": {
      "resource": "href renders a native anchor",
      "application_action": "no href renders a button and emits sf-download-file:click",
      "disabled": "disabled button with no live destination"
    },
    "canonical_elements": {
      "type": "string",
      "enum": [
        "sf-download-file__body",
        "sf-download-file__main",
        "sf-download-file__icon",
        "sf-download-file__name",
        "sf-download-file__size"
      ]
    },
    "interaction_states": {
      "type": "string",
      "enum": [
        "hover",
        "active",
        "focus-visible"
      ]
    },
    "compatibility": {
      "size_lookup": "an empty size preserves the existing Content-Length lookup"
    }
  },
  "methods": {},
  "events": {
    "sf-download-file:click": {
      "summary": "Emitted once for an enabled native destination or application-owned action.",
      "payload": {
        "type": "object"
      }
    }
  },
  "state": {
    "machines": {},
    "visual_states": [
      "default",
      "active",
      "disabled"
    ]
  },
  "persistence": {
    "mode": "none",
    "source_of_truth": "component",
    "network_owner": "none",
    "revision_field": null
  },
  "ownership": {
    "source": "simai/ui-source",
    "data": "fixture",
    "effects": "component",
    "forbidden_client_responsibilities": [
      "backend access decisions",
      "host route invention"
    ]
  },
  "security": {
    "permissions_owner": "none",
    "untrusted_inputs": [
      "props",
      "children"
    ],
    "network_policy": "deny"
  },
  "accessibility": {
    "role": null,
    "accessible_name": "recommended",
    "keyboard": [
      "Tab"
    ],
    "focus": "Keep visible focus on the active control."
  },
  "presentation": {
    "themes": [
      "light",
      "dark"
    ],
    "locales": [
      "ru",
      "en"
    ],
    "responsive": [
      "desktop",
      "mobile"
    ]
  },
  "adapter": {
    "kind": "generic",
    "protocol": "simai.smart-studio-adapter.v1",
    "module": null
  },
  "artifacts": {
    "fixtures": [
      "studio.fixture.json"
    ],
    "scenarios": [
      "studio.scenario.json"
    ]
  },
  "readiness": {
    "level": "described",
    "required_checks": [
      "manifest",
      "fixture",
      "runtime-upgrade",
      "scenario-smoke"
    ]
  },
  "compatibility": {
    "contract_schema": {
      "id": "https://simai.io/contracts/smart-component-manifest.v2.schema.json",
      "version": 2
    },
    "runtime_pair": {
      "ui_revision": "2228262ad3588227b20045f66ca43556fcd27974",
      "ui_smart_revision": "8b0e0482f78a19aa6af2483d61fe9fe3b79a8e1b"
    },
    "aliases": [],
    "deprecations": [],
    "replacement": null,
    "migrations": []
  },
  "provenance": {
    "source_repository": "simai/ui-source",
    "source_revision": "fbea718f2a7fcf7450ec0a5a52a512fc805aa823",
    "source_artifacts": [
      {
        "path": "src/smart/download-file/index.js",
        "sha256": "c30b14206e611b7b6651ee2331b34963c1a0c8807405762a82fd504216153fed"
      }
    ],
    "generated_runtime": [
      {
        "repository": "simai/ui-smart",
        "revision": "8b0e0482f78a19aa6af2483d61fe9fe3b79a8e1b",
        "path": "smart/download-file/js/download-file.js",
        "sha256": "2c4bcb864b7387b9803c40d31d049efba02d2980f80ef019e6ba5b3deed3a3d1"
      }
    ]
  },
  "ai_guidance": {
    "use_when": "Use sf-download-file for one downloadable resource or an application-owned file preparation action.",
    "do_not": [
      "Do not use a button when a stable resource href already exists",
      "Do not leave href on an unavailable file",
      "Do not use the decorative icon as the accessible name",
      "Do not copy generated ui-smart code",
      "Do not move host data or access decisions into the component"
    ],
    "required_reads": [
      "inputs",
      "methods",
      "events",
      "ownership",
      "provenance"
    ],
    "minimal_example": "<sf-download-file file-name=\"Report.pdf\" file-size=\"2.4 MB\" href=\"/files/report.pdf\" download></sf-download-file>",
    "owner_commands": [
      "npm run contract:verify",
      "npm test"
    ]
  }
}
